{
  "run_id": "test-run",
  "source_logs": [
    "/workspace/speckit/sample-logs/run.log"
  ],
  "started_at": "2024-01-01T00:00:00.000Z",
  "finished_at": "2025-09-26T22:10:56.429Z",
  "events": [
    {
      "id": "line-1",
      "timestamp": "2024-01-01T00:00:00.000Z",
      "kind": "log",
      "output": "2024-01-01T00:00:00Z PLAN: Implement feature X"
    },
    {
      "id": "line-2",
      "timestamp": "2024-01-01T00:00:05.000Z",
      "kind": "log",
      "output": "2024-01-01T00:00:05Z TOOL: git status"
    },
    {
      "id": "line-3",
      "timestamp": "2024-01-01T00:00:10.000Z",
      "kind": "log",
      "output": "2024-01-01T00:00:10Z EDIT: Updated README"
    },
    {
      "id": "line-4",
      "timestamp": "2024-01-01T00:00:15.000Z",
      "kind": "log",
      "output": "2024-01-01T00:00:15Z LOG: Completed requirement to update docs"
    },
    {
      "id": "line-5",
      "timestamp": "2025-09-26T22:10:52.429Z",
      "kind": "log",
      "output": "PROMPT START"
    },
    {
      "id": "line-6",
      "timestamp": "2025-09-26T22:10:53.429Z",
      "kind": "log",
      "output": "- Update README with agent run forensics quick start."
    },
    {
      "id": "line-7",
      "timestamp": "2025-09-26T22:10:54.429Z",
      "kind": "log",
      "output": "- Ensure RTM table includes latest requirement."
    },
    {
      "id": "line-8",
      "timestamp": "2025-09-26T22:10:55.429Z",
      "kind": "log",
      "output": "PROMPT END"
    },
    {
      "id": "line-9",
      "timestamp": "2025-09-26T22:10:56.429Z",
      "kind": "log",
      "output": ""
    }
  ]
}
